{
  "$schema": "../../templates/libs-catalog.schema.json",
  "stackId": "backend-nestjs",
  "category": "backend",
  "schemaVersion": 1,
  "buildSystem": "pnpm",
  "manifest": {
    "files": [
      "workspace/src/{AppName}/package.json",
      "workspace/src/{AppName}/pnpm-lock.yaml",
      "workspace/src/{AppName}/tsconfig.json",
      "workspace/src/{AppName}/nest-cli.json"
    ]
  },
  "versions": {
    "node": "22",
    "nestjs-core": "12.1.0",
    "nestjs-common": "12.1.0",
    "nestjs-platform-express": "12.1.0",
    "nestjs-config": "12.0.1",
    "nestjs-swagger": "12.0.2",
    "nestjs-testing": "12.1.0",
    "nestjs-cli": "12.0.5",
    "nestjs-schematics": "12.0.5",
    "nestjs-jwt": "12.0.2",
    "nestjs-terminus": "12.1.0",
    "nestjs-throttler": "6.7.0",
    "reflect-metadata": "0.2.2",
    "rxjs": "7.8.2",
    "zod": "4.6.5",
    "nestjs-zod": "5.5.0",
    "helmet": "8.3.0",
    "pino": "10.3.1",
    "nestjs-pino": "5.2.0",
    "pino-http": "11.0.0",
    "opentelemetry-sdk-node": "0.222.0",
    "opentelemetry-api": "1.9.1",
    "typescript": "6.0.3",
    "types-node": "26.6.2",
    "types-express": "4.17.25",
    "jest": "30.5.2",
    "ts-jest": "29.4.13",
    "types-jest": "30.0.0",
    "supertest": "7.3.0",
    "types-supertest": "7.2.1",
    "eslint": "10.11.0",
    "typescript-eslint": "8.70.1",
    "prettier": "3.9.9"
  },
  "core": [
    {
      "module": "@nestjs/core",
      "ref": "nestjs-core",
      "rationale": "Conteneur d'injection, modules, cycle de vie : la composition a un endroit naturel."
    },
    {
      "module": "@nestjs/common",
      "ref": "nestjs-common"
    },
    {
      "module": "@nestjs/platform-express",
      "ref": "nestjs-platform-express",
      "rationale": "Adaptateur HTTP par défaut ; Fastify via la capability fastify-adapter."
    },
    {
      "module": "@nestjs/config",
      "ref": "nestjs-config",
      "rationale": "ConfigService, seul lecteur de l'environnement, validé par Zod au démarrage."
    },
    {
      "module": "@nestjs/swagger",
      "ref": "nestjs-swagger",
      "rationale": "PUBLIE le document OpenAPI ; le contrat de référence reste celui de l'IR, confronté par validate-api-contract."
    },
    {
      "module": "reflect-metadata",
      "ref": "reflect-metadata",
      "rationale": "Requis par les décorateurs Nest (emitDecoratorMetadata conservé)."
    },
    {
      "module": "rxjs",
      "ref": "rxjs"
    },
    {
      "module": "zod",
      "ref": "zod",
      "rationale": "Schémas GÉNÉRÉS depuis l'IR ; une seule source de schéma."
    },
    {
      "module": "nestjs-zod",
      "ref": "nestjs-zod",
      "rationale": "Pipe de validation Zod à la place de class-validator : évite deux sources de schéma."
    },
    {
      "module": "helmet",
      "ref": "helmet",
      "rationale": "Dans main.ts, avant tout."
    },
    {
      "module": "pino",
      "ref": "pino"
    },
    {
      "module": "nestjs-pino",
      "ref": "nestjs-pino",
      "rationale": "Logger Nest sur pino, corrélé par requête."
    },
    {
      "module": "pino-http",
      "ref": "pino-http"
    },
    {
      "module": "typescript",
      "ref": "typescript",
      "rationale": "Plafonné sous 7 (lang/typescript.md §7)."
    },
    {
      "module": "@nestjs/cli",
      "ref": "nestjs-cli"
    },
    {
      "module": "@nestjs/schematics",
      "ref": "nestjs-schematics"
    },
    {
      "module": "@nestjs/testing",
      "ref": "nestjs-testing",
      "rationale": "Test.createTestingModule : substituer un fournisseur sans toucher au code."
    },
    {
      "module": "jest",
      "ref": "jest"
    },
    {
      "module": "ts-jest",
      "ref": "ts-jest"
    },
    {
      "module": "@types/node",
      "ref": "types-node"
    },
    {
      "module": "@types/express",
      "ref": "types-express"
    },
    {
      "module": "@types/jest",
      "ref": "types-jest"
    },
    {
      "module": "eslint",
      "ref": "eslint"
    },
    {
      "module": "typescript-eslint",
      "ref": "typescript-eslint"
    },
    {
      "module": "prettier",
      "ref": "prettier"
    }
  ],
  "onDemand": [
    {
      "module": "@nestjs/jwt",
      "ref": "nestjs-jwt",
      "capability": "auth-jwt",
      "rationale": "ApiAuthMode: oauth2 — l'identité vient du jeton, posée par un guard.",
      "triggers": [
        "ApiAuthMode:\\s*oauth2",
        "jwt",
        "bearer"
      ]
    },
    {
      "module": "@nestjs/terminus",
      "ref": "nestjs-terminus",
      "capability": "healthcheck",
      "rationale": "Indicateurs de santé prêts à l'emploi, mappés sur /healthz et /readyz.",
      "triggers": [
        "healthz",
        "readyz",
        "liveness",
        "readiness"
      ]
    },
    {
      "module": "@nestjs/throttler",
      "ref": "nestjs-throttler",
      "capability": "rate-limit",
      "rationale": "Quota par appelant (P6).",
      "triggers": [
        "rate.?limit",
        "quota",
        "429",
        "throttl"
      ]
    },
    {
      "module": "supertest",
      "ref": "supertest",
      "capability": "e2e-http",
      "triggers": [
        "e2e",
        "supertest"
      ]
    },
    {
      "module": "@types/supertest",
      "ref": "types-supertest",
      "capability": "e2e-http",
      "triggers": [
        "e2e",
        "supertest"
      ]
    },
    {
      "module": "@opentelemetry/sdk-node",
      "ref": "opentelemetry-sdk-node",
      "capability": "otel-http",
      "triggers": [
        "otel",
        "opentelemetry",
        "traceparent"
      ]
    },
    {
      "module": "@opentelemetry/api",
      "ref": "opentelemetry-api",
      "capability": "otel-http",
      "triggers": [
        "otel",
        "opentelemetry",
        "traceparent"
      ]
    }
  ],
  "absentByDesign": [
    {
      "module": "typeorm",
      "reason": "Aucune base possédée : l'accès aux données appartient à dev-data derrière l'enveloppe de ## Active Data Access."
    },
    {
      "module": "@nestjs/typeorm",
      "reason": "Idem typeorm."
    },
    {
      "module": "prisma",
      "reason": "Idem : pas de client de base dans la coquille."
    },
    {
      "module": "passport",
      "reason": "L'identité est établie par un fournisseur externe ou une passerelle (ApiAuthMode) et lue par un guard ; aucun compte local, donc aucune stratégie locale."
    },
    {
      "module": "passport-local",
      "reason": "Aucun compte utilisateur local dans un système agentic généré."
    },
    {
      "module": "argon2",
      "reason": "Aucun mot de passe à hacher : pas de compte local."
    },
    {
      "module": "class-validator",
      "reason": "Zod (nestjs-zod) porte la validation depuis les schémas GÉNÉRÉS ; une seconde source de schéma diverge."
    }
  ],
  "runtimeRequirements": {
    "node": ">=22",
    "notes": "Temps de démarrage plus long qu'Express : /readyz doit attendre onApplicationBootstrap. Checkpointer partagé dès qu'il y a plus d'un processus."
  },
  "metadata": {
    "lastUpdated": "2026-09-23",
    "status": "design-phase",
    "format": "compact (v2) — aligné sur SDD_Pro libs-catalog.schema.json",
    "notes": [
      "Hérité de SDD_Pro .sdd/stacks/backend/nestjs.libs.json (construit le 2026-09-02), RÉÉCRIT pour l'agentic : TypeORM, Prisma, Passport, Argon2, class-validator retirés ; nestjs-zod et OpenTelemetry en place.",
      "typescript plafonné à 6.0.3 et emitDecoratorMetadata conservé : les deux flags load-bearing relevés par l'audit SDD_Pro.",
      "Les clés de versions{} sont des ALIAS internes (`langchain-core` pour `@langchain/core`) : le méta-schéma refuse un nom qui commence par `@`. Le `module` porte l'identifiant npm exact."
    ],
    "changeLog": [
      "2026-09-23 — Création depuis SDD_Pro ; résolution registry.npmjs.org via `npm view` : @nestjs/core|common|platform-express|testing 12.0.1→12.1.0 · @nestjs/config 12.0.0→12.0.1 · @nestjs/swagger →12.0.2 · @nestjs/cli|schematics 12.0.0→12.0.5 · @nestjs/jwt →12.0.2 · @nestjs/terminus 12.0.0→12.1.0 · @nestjs/throttler 6.5.0→6.7.0 · nestjs-pino 5.1.0→5.2.0 · jest 30.5.1→30.5.2 · ts-jest 29.4.12→29.4.13 · supertest 7.2.2→7.3.0 · prettier 3.9.6→3.9.9 · eslint 10.9.1→10.11.0 · typescript-eslint 8.69.0→8.70.1 · @types/node 26.4.1→26.6.2 · zod 4.5.4→4.6.5."
    ],
    "versionsVerified": true,
    "verifiedAt": "2026-09-23",
    "verifiedAgainst": "registry.npmjs.org via `npm view <pkg> version`"
  }
}
