{
  "$schema": "../../templates/libs-catalog.schema.json",
  "stackId": "serving-fastapi-sse",
  "category": "serving",
  "schemaVersion": 1,
  "buildSystem": "uv",
  "manifest": {
    "files": [
      "workspace/src/{AppName}/pyproject.toml",
      "workspace/src/{AppName}/uv.lock"
    ]
  },
  "metadata": {
    "status": "design-phase",
    "lastUpdated": "2026-09-22",
    "versionsVerified": true,
    "notes": [
      "Versions portées de SDD_Pro .sdd/stacks/backend/python-fastapi.libs.json, qui les audite (CVE, LTS). Les dupliquer en les re-choisissant produirait deux vérités qui divergent au premier bump. `sse-starlette` et `opentelemetry-*` sont propres à l'agentic et n'ont pas d'équivalent amont : ils sont marqués unverified.",
      "Pins résolus conjointement le 2026-09-22 : l'union des catalogues Python est passée à `uv pip compile --python-version 3.12`, donc les versions sont mutuellement compatibles et non « la dernière de chaque paquet ». `pgvector` reste en 0.3.6 parce que `langchain-postgres` le contraint — 0.5.0 est publié mais incompatible avec le reste du catalogue."
    ],
    "verifiedAt": "2026-09-22",
    "verifiedAgainst": "pypi.org via `uv pip compile` (résolution conjointe des catalogues Python, Python 3.12)",
    "changeLog": [
      "2026-09-22 — Résolution PyPI (6) : uvicorn 0.52.4→0.53.0 · sse-starlette 3.0.2→3.4.11 · pyjwt 2.13.0→2.14.0 · opentelemetry-instrumentation-fastapi 0.58b0→0.65b0 · msal 1.35.0→1.39.0 · ruff 0.16.5→0.16.8"
    ]
  },
  "versions": {
    "python": "3.12",
    "fastapi": "0.141.1",
    "uvicorn": "0.53.0",
    "sse-starlette": "3.4.11",
    "pydantic": "2.13.5",
    "pydantic-settings": "2.15.0",
    "structlog": "26.1.0",
    "httpx": "0.28.1",
    "tenacity": "9.1.4",
    "slowapi": "0.1.10",
    "python-multipart": "0.0.32",
    "pyjwt": "2.14.0",
    "email-validator": "2.3.0",
    "opentelemetry-instrumentation-fastapi": "0.65b0",
    "msal": "1.39.0",
    "ruff": "0.16.8",
    "mypy": "2.3.1"
  },
  "core": [
    {
      "module": "fastapi",
      "ref": "fastapi",
      "rationale": "Routage, injection de dépendances (la voie par laquelle l'identité de l'appelant entre — cf. fiche §5.1) et génération OpenAPI, confrontée à l'IR par l'API GATE."
    },
    {
      "module": "uvicorn[standard]",
      "ref": "uvicorn",
      "rationale": "Serveur ASGI. `[standard]` apporte httptools et uvloop ; sans eux le p95 sous charge est dominé par la boucle d'événements, pas par les modèles."
    },
    {
      "module": "sse-starlette",
      "ref": "sse-starlette",
      "rationale": "EventSourceResponse : keepalive périodique et détection de déconnexion. Les réécrire à la main est le chemin le plus court vers un flux que le proxy coupe (fiche §8.3) et un run qui continue à facturer sans lecteur (§8.5)."
    },
    {
      "module": "pydantic",
      "ref": "pydantic",
      "rationale": "RunRequest / RunResponse GÉNÉRÉS depuis les inputSchema/outputSchema de l'IR. Le schéma est dérivé, jamais écrit à la main (fiche §6)."
    },
    {
      "module": "pydantic-settings",
      "ref": "pydantic-settings",
      "rationale": "Settings depuis .env — la seule voie de lecture des secrets. Un os.environ direct sur une clé est [SEC_ENV_VAR_FORBIDDEN]."
    },
    {
      "module": "structlog",
      "ref": "structlog",
      "rationale": "Logs structurés sur stderr. Le contrat de la surface impose que rien d'autre que du NDJSON/SSE ne sorte sur le canal de résultat."
    },
    {
      "module": "httpx",
      "ref": "httpx",
      "rationale": "Client HTTP async. Un client synchrone dans un `async def` bloque la boucle et le service sert une requête à la fois (fiche §8.4)."
    },
    {
      "module": "tenacity",
      "ref": "tenacity",
      "rationale": "Backoff exponentiel avec jitter sur 429/503 du fournisseur de modèles."
    },
    {
      "module": "ruff",
      "ref": "ruff",
      "rationale": "Lint L0."
    },
    {
      "module": "mypy",
      "ref": "mypy",
      "rationale": "Typage L0 : le contrat d'événements est un union discriminé, et c'est mypy qui garantit qu'aucune branche n'est oubliée."
    }
  ],
  "onDemand": [
    {
      "module": "slowapi",
      "ref": "slowapi",
      "capability": "rate-limit",
      "rationale": "Quota par appelant -> 429. Sur une surface agentic, le quota n'est pas un confort d'exploitation : sans lui, un appelant épuise le budget d'exécution du produit (P6) en quelques requêtes.",
      "triggers": [
        "rate.?limit",
        "quota",
        "429",
        "throttl"
      ]
    },
    {
      "module": "pyjwt[crypto]",
      "ref": "pyjwt",
      "capability": "auth-jwt",
      "rationale": "Vérification de jeton pour ApiAuthMode: oauth2. L'identité vient du jeton, jamais du corps de la requête.",
      "triggers": [
        "ApiAuthMode:\\s*oauth2",
        "jwt",
        "bearer"
      ]
    },
    {
      "module": "msal",
      "ref": "msal",
      "capability": "auth-azure-ad",
      "rationale": "ApiAuthMode: azure-ad — validation des jetons Entra ID.",
      "triggers": [
        "ApiAuthMode:\\s*azure-ad",
        "azure.?ad",
        "entra"
      ]
    },
    {
      "module": "python-multipart",
      "ref": "python-multipart",
      "capability": "file-upload",
      "rationale": "Requis par FastAPI dès qu'un endpoint accepte un fichier. Une entrée fichier est Untrusted au même titre qu'un corps JSON.",
      "triggers": [
        "UploadFile",
        "multipart",
        "upload"
      ]
    },
    {
      "module": "email-validator",
      "ref": "email-validator",
      "capability": "email-validation",
      "rationale": "Requis par pydantic dès qu'un schéma porte un EmailStr.",
      "triggers": [
        "EmailStr",
        "email"
      ]
    },
    {
      "module": "opentelemetry-instrumentation-fastapi",
      "ref": "opentelemetry-instrumentation-fastapi",
      "capability": "otel-http",
      "rationale": "Propagation du traceparent W3C entre l'appelant et les spans d'agents. Sans elle, la trace du run commence au RunService et l'on perd la latence réellement vue par le client.",
      "triggers": [
        "otel",
        "opentelemetry",
        "traceparent"
      ]
    }
  ],
  "absentByDesign": [
    {
      "module": "sqlalchemy",
      "reason": "La surface ne touche aucune donnée : l'accès aux données appartient à `dev-data` et vit derrière l'enveloppe de `## Active Data Access`. Une session de base dans un endpoint est le premier pas vers une règle métier hors du chemin que les evals parcourent."
    },
    {
      "module": "alembic",
      "reason": "Idem : les migrations appartiennent à la couche données, pas à la surface."
    },
    {
      "module": "celery",
      "reason": "L'exécution différée d'un lot appartient à `serving/batch.md`, qui est une surface à part entière avec son journal de reprise. Une file de tâches ici dupliquerait ce mécanisme sans son audit."
    }
  ],
  "runtimeRequirements": {
    "python": ">=3.12",
    "notes": "Un checkpointer PARTAGÉ est requis dès qu'il y a plus d'un worker uvicorn : sinon une reprise tombe sur un worker qui n'a jamais vu le thread. Vérifié par /readyz (fiche §8.13)."
  }
}
